,公司代號,公司名稱,公司簡稱,產業類別,外國企業註冊地國,住址,營利事業統一編號,董事長,總經理,發言人,發言人職稱,代理發言人,總機電話,成立日期,上櫃日期,普通股每股面額,實收資本額(元),已發行普通股數或TDR原發行股數,私募普通股(股),特別股(股),編製財務報告類型,普通股盈餘分派或虧損撥補頻率,普通股年度(含第4季或後半年度)現金股息及紅利決議層級,股票過戶機構,過戶電話,過戶地址,簽證會計師事務所,簽證會計師1,簽證會計師2,英文簡稱,英文通訊地址,傳真機號碼,電子郵件信箱,公司網址,投資人關係聯絡人,投資人關係聯絡人職稱,投資人關係聯絡電話,投資人關係聯絡電子郵件,公司網站內利害關係人專區網址
0,3085,創新新零售股份有限公司,新零售,電子商務,－,台北市大同區南京西路66號5樓,89836340,潘奕彰,陳韋利,陳采葳,財務部協理,李爵君,(02)25596189,83/09/01,93/03/01,新台幣 10.0000元,480385770,48038577,35157415,0,合併,每年,股東會,宏遠證券股份有限公司,(02)77198899,台北市大安區信義路4段236號3樓,馬施云大華聯合會計師事務所,郭思琪,羅玟忻,NEWRETAIL,"5F., No. 66, Nanjing W. Rd., Datong Dist.Taipei City, Taiwan R.O.C",(02)25591518,patti.lee@newretail.com.tw,http://www.newretail.com.tw/,李爵君,AGM,02-25596189,patti.lee@newretail.com.tw,http://www.newretail.com.tw/
1,3687,茂為歐買尬數位科技股份有限公司,歐買尬,電子商務,－,台北市南港區三重路19-2號D棟7樓之1,70444999,林雪慧,羅士博,羅士博,總經理,丘志羚,02-26550051,88/10/18,100/01/11,新台幣 10.0000元,300595720,30059572,0,0,合併,每年,董事會,台新證券股務代理部,02-25048125,台北市建國北路一段96號地下一樓,勤業眾信聯合會計師事務所,張青霞,趙永祥,OMG,"7F.-1, No. 19-2, Sanchong Rd.,Nangang District, Taipei City 115,Taiwan",02-26550051,financial_material@mail.omg.com.tw,http://www.macrowell.com.tw/,羅士博,總經理,02-26550051,financial_material@mail.omg.com.tw,http://www.macrowell.com.tw/
2,5278,尚凡國際創新科技股份有限公司,尚凡,電子商務,－,(106)台北市大安區羅斯福路三段37號12樓,80283629,張家銘,張家銘,張家銘,董事長兼總經理,張立,02-23650103,91/10/07,102/06/04,新台幣 10.0000元,152391000,15239100,0,0,合併,每季,董事會,日盛證券股份有限公司股務代理部,02-25419977,台北市中山區南京東路二段85號7樓,資誠聯合會計師事務所,徐聖忠,徐潔如,Sunfun,"12F., No.37, Sec. 3, Roosevelt Rd., Da-an District,Taipei City 106, TaiwanTaipei City , Taiwan",02-23650112,IR@ipair.com,www.i-part.com.tw,陳俐君,經理,02-23650103#2203,ir@ipair.com,http://www.i-part.com.tw/announce/rules/rules_investment.php
3,5287,數字科技股份有限公司,數字,電子商務,－,241新北巿三重區重新路五段609巷12號10樓,28466605,廖世芳,吳聰賢,吳聰賢,總經理,游儲宇,(02)2999-5691,96/01/23,103/01/20,新台幣 10.0000元,429370000,42937000,0,0,合併,每年,董事會,群益金鼎證券股份有限公司,(02)2703-5000,台北市大安區敦化南路二段97號B2,安侯建業聯合會計師事務所,陳振乾,黃泳華,ADDCN,"10F, NO.12, LANE 609, SEC.5, CHUGSHIN RD.,SANCHONG CITY, TAIPEI TAIWAN R.O.C",(02)2999-6285,ir@addcn.com,http://www.addcn.com,游儲宇,副理,02-2999-5691,peter.yu@addcn.com,http://www.addcn.com
4,6741,"91APP, Inc.",91APP*-KY,電子商務,KY 開曼群島,"P.O. Box 10655, Grand Cayman, KY1-1006, Cayman Islands",88176897,何英圻,楊明芳,莊豐賓,財務長,楊明芳,02-26538091,102/07/08,110/05/25,新台幣 5.0000元,602889985,120577997,0,0,合併,每年,董事會,元大證券股份有限公司股務代理部,02-25865859,台北市承德路三段210號地下一樓,勤業眾信聯合會計師事務所,林宜慧,曾建銘,91APP,"6F., No. 5, Ln. 768, Sec. 4, Bade Rd., Nangang Dist.Taipei City 115 , Taiwan (R.O.C.)",02-26538890,IR@91app.com,https://www.91app.com,莊豐賓,財務長,02-66236741,IR@91app.com,https://www.91app.com
5,8044,網路家庭國際資訊股份有限公司,網家,電子商務,－,台北市敦化南路二段105號12樓,16606102,詹宏志,蔡凱文,周磊,副總,甯智倫,27000898,87/07/14,94/01/24,新台幣 10.0000元,1274159090,127415909,9376463,0,合併,每年,董事會,台新證券股務代理部,2504-8125,台北市建國北路一段96號地下一樓,安侯建業會計師事務所,陳宜君,連淑凌,PChome online,"12F, 105, Sec. 2, Tun-Hwa S. Rd.Taipei Taiwan",2709-5021,llee@staff.pchome.com.tw,www.pchome.com.tw,盧靜美,行銷總監,02-2700-0898,ir@pchome.tw,https://corp.pchome.tw/corporate-social-responsibility/stakeholder-communication/
6,8472,夠麻吉股份有限公司,夠麻吉,電子商務,－,台北市大安區市民大道四段100號4樓,25145643,吳進昌,宋雪美,宋雪美,總經理,王玉玲,02-2711-8177,99/07/12,105/01/11,新台幣 10.0000元,177358000,17735800,0,0,合併,每年,股東會,福邦證券 股務代理部,02-2371-1658,台北市中正區忠孝西路１段６號６樓,勤業眾信聯合會計師事務所,陳俊宏,莊碧玉,GOMAJI,"4F., No.100, Sec. 4, Civic Blvd., Da'an DistTaipei City , Taiwan (R.O.C.)",02-2741-4271,invest@gomaji.com,http://www.gomaji.com/,陳宜斌,副總,(02) 2711-8177#730,invest@gomaji.com,http://www.gomaji.com/stakeholder/pip_0.php
7,8477,創業家兄弟股份有限公司,創業家,電子商務,－,台北市南港區三重路19-3號5樓,53761823,郭書齊,郭書齊,金佑儒,財務長,楊雅朱,02-26552939,101/05/03,105/10/31,新台幣 10.0000元,315928380,31592838,0,0,合併,每年,股東會,群益金鼎證券股務代理部,02-27035000,台北市敦化南路2段97號B2樓,勤業眾信聯合會計師事務所,莊碧玉,郭慈容,KUOBROTHERS,"5F., NO.19-3, SANCHONG RD., NANGANG DISTTAIPEI CITY 115, TAIWAN (R.O.C.)",02-26550329,ir@kuobrothers.com,http://www.kuobrothers.com,金佑儒,財務長,(02)2655-9338,ir@kuobrothers.com,
