,公司代號,公司名稱,公司簡稱,產業類別,外國企業註冊地國,住址,營利事業統一編號,董事長,總經理,發言人,發言人職稱,代理發言人,總機電話,成立日期,上市日期,普通股每股面額,實收資本額(元),已發行普通股數或TDR原發行股數,私募普通股(股),特別股(股),編製財務報告類型,普通股盈餘分派或虧損撥補頻率,普通股年度(含第4季或後半年度)現金股息及紅利決議層級,股票過戶機構,過戶電話,過戶地址,簽證會計師事務所,簽證會計師1,簽證會計師2,英文簡稱,英文通訊地址,傳真機號碼,電子郵件信箱,公司網址,投資人關係聯絡人,投資人關係聯絡人職稱,投資人關係聯絡電話,投資人關係聯絡電子郵件,公司網站內利害關係人專區網址
0,1903,士林紙業股份有限公司,士紙,造紙工業,－,台北市士林區福德路31號,11038101,臺實貿易股份有限公司,蔡丞哲,蔡丞哲,總經理,洪文忠,(02)28811111,48/09/08,52/12/09,新台幣 10.0000元,2600391210,260039121,0,0,合併,每年,股東會,凱基證券股份有限公司股務代理部,(02)23892999,(100)台北市重慶南路一段2號5樓,惠眾聯合會計師事務所,洪佑伶,卓敏枝,Shihlin Paper,"NO.31, Futeh RoadShihlin District,Taipei,Taiwan",(02)28827099,hwc@shihlin.com.tw,www.shihlin.com.tw,蔡丞哲,總經理,(02)28811111,jerry@shihlin.com.tw,http://www.shihlin.com.tw/stakeholder.html
1,1904,正隆股份有限公司,正隆,造紙工業,－,板橋區民生路一段一號,33085508,鄭舒云,張清標,何台桹,協理,林祥註,02-22225131,48/02/04,60/09/10,新台幣 10.0000元,11082745220,1108274522,0,0,合併,每年,董事會,本公司財務部股務課,02-22225131,板橋區民生路一段三號三樓,安侯建業聯合會計師事務所,吳美萍,于紀隆,Cheng Loong,"No. 1, Sec .1, Minsheng Rd.Banqiao Dist., New Taipei City, Taiwan",02-22226110,stocks@mail.clc.com.tw,www.clc.com.tw,何台桹,協理,02-22225131,spokesperson@mail.clc.com.tw,http://www.clc.com.tw/htmltest/about/contactus.asp
2,1905,中華紙漿股份有限公司,華紙,造紙工業,－,台北市重慶南路二段51號,94025264,黃鯤雄,陳瑞和/秋山芳廣,陳瑞和,纖維材料事業部總經理,林冠均,(02)2396-2998,57/07/05,64/02/07,新台幣 10.0000元,11028353160,1102835316,0,0,合併,每年,股東會,永豐金證券(股)公司股務代理部,(02)23816288,台北市博愛路17號3樓,勤業眾信聯合會計師事務所,林淑婉,黃惠敏,CHP,"No.51,Sec2,Chung-ching S. RdTAIPEI, TAIWAN",(02)23953755,public.chp@yfy.com,http://www.chp.com.tw,林晟煒,專員,(02)2396-2998#1358,IR.chp@yfy.com,http://www.chp.com.tw/responsibility/stakeholders
3,1906,寶隆國際股份有限公司,寶隆,造紙工業,－,雲林縣斗六市十三北路25號,12030606,李復元,李復元,張玉城,資深經理,徐維澤,02-5581-1777,54/05/20,65/04/26,新台幣 10.0000元,1510000000,151000000,0,0,個別,每半會計年度,董事會,元大證券股份有限公司,02-2586-5859,10366台北市大同區承德路三段210號B1,立本台灣聯合會計師事務所,張宜鈞,陶鴻文,Baolong Intl.,"No.25, Shisan N. Rd., Douliu City, Yunlin CountyYUNLIN HSIEN,TAIWAN,R.O.C.",02-5581-1778,office@baolongintl.com,www.baolongintl.com,徐維澤,經理,02-55811777#557,k0111@baolongintl.com,http://www.baolongintl.com/B4001.asp
4,1907,永豐餘投資控股股份有限公司,永豐餘,造紙工業,－,台北市重慶南路二段51號,85066002,劉慧瑾,蔡維力,殷國堂,副總經理,--,02-23968020,39/02/20,66/02/22,新台幣 10.0000元,16603714950,1660371495,0,0,合併,每年,董事會,永豐金證券(股)公司股務代理部,(02)2381-6288,台北市中正區博愛路17號3樓,勤業眾信會計師事務所,黃惠敏,翁雅玲,YFY,"51,Sec.2,Chung Ching South RoadTaipei,Taiwan,R.O.C.",02-23215940,IR@yfy.com,www.yfy.com,廖苑珊,經理,02-23968020#1139,Susan.Liao@yfy.com,http://www.yfy.com/tw/csr_interestedParties.html
5,1909,榮成紙業股份有限公司,榮成,造紙工業,－,彰化縣二林鎮廣興里廣興巷1-1號,34202841,鄭瑛彬,鄭瑛彬,王瑞榮,協理,黃世瑜,02-5581-1777,67/03/18,74/11/19,新台幣 10.0000元,12776857270,1277685727,0,0,合併,每半會計年度,董事會,元大證券股份有限公司,02-2586-5859,10366台北市大同區承德路三段210號B1,立本台灣聯合會計師事務所,王慕凡,陶鴻文,Longchen P&P,"1-1,kuang Hsin Lane, Kuang Hsin Li,Erlin Town,Changhwa, Taiwan",02-5581-1778,jjwang@longchenpaper.com,www.longchenpaper.com,王瑞榮,協理,02-5581-1777,jjwang@longchenpaper.com,www.longchenpaper.com/stakeholder.html
6,6790,永豐餘消費品實業股份有限公司,永豐實,造紙工業,－,臺北市中正區重慶南路2段51號16樓,22327037,何奕達,徐志宏,陳佩雯,財務長,顏靜雯,02-21921022,75/10/29,110/09/29,新台幣 10.0000元,2671290210,267129021,0,0,合併,每年,股東會,永豐金證券股份有限公司,02-23816288,台北市博愛路17號3樓,勤業眾信聯合會計師事務所,林淑婉,許秀明,YFYCPG,"16F,51,Sec.2,Chung Ching South RoadTaipei,Taiwan,R.O.C.",02-23224981,ir.cpg@yfycpg.com,https://www.yfycpg.com/,原靖婷,副理,02-21921022#623,ir.cpg@yfycpg.com,https://www.yfycpg.com/?page_id=236
