38,6122,擎邦國際科技工程股份有限公司,擎邦,電機機械,－,台北市內湖區瑞光路210號5樓,05114306,洪振攀,張明燦,許錦碧,副總經理,王國安,8751-0858,71/08/21,89/07/14,新台幣 10.0000元,707909610,70790961,0,0,合併,每年,股東會,富邦綜合證券股份有限公司代理部,2361-1300,台北市許昌街17號2樓,安侯建業聯合會計師事務所,黃明宏,唐嘉鍵,KPEC,"5th floor, 210, Ruiguang Rd., Neihu DistTaipei, Taiwan",8751-2407,kacct@kpec.com.tw,www.kpec.com.tw,許錦碧,副總經理,(02)8751-0858,kacct@kpec.com.tw,"www,kpec.com.tw"
39,6425,易發精機股份有限公司,易發,電機機械,－,桃園市中壢區自強四路3-2號,22994919,羅文進,劉國麟,邱耀進,管理部副總,龔光寰,03-4514199,77/08/22,108/01/18,新台幣 10.0000元,436020000,43602000,0,0,合併,每年,股東會,福邦證券股份有限公司,02-23711658,台北市中正區忠孝西路一段6號6樓,勤業眾信聯合會計師事務所,吳恪昌,黃毅民,EFC,"No.3-2, Ziqiang 4th Rd., Zhongli CityTaoyuan County 320, Taiwan (R.O.C.)",03-4517898,pr@efctw.com,https://www.efctw.com,邱耀進,管理部副總,03-4514199,pr@efctw.com,https://www.efctw.com
40,6603,富強鑫精密工業股份有限公司,富強鑫,電機機械,－,台南市關廟區埤頭里保東路269號,86122164,王伯壎,王俊賢,張銀鶯,董事長特助,劉崇敬,06-5950688,80/07/17,93/04/05,新台幣 10.0000元,1494387800,149438780,0,0,合併,每年,股東會,中國信託商業銀行代理部,02-66365566,台北市中正區重慶南路一段83號5F,安永聯合會計師事務所,洪國森,李芳文,FCS,"269, Bao Dong Road, Pi Tou Village, Guanmiao Dist.,Tainan , Taiwan, R.O.C.",06-5964038,fcs1933@fcs.com.tw,www.fcs.com.tw,張銀鶯,董事長特助,06-5950688-8877,ying@fcs.com.tw,www.fcs.com.tw/tw/interested.php
41,6609,台灣瀧澤科技股份有限公司,瀧澤科,電機機械,－,桃園市平鎮區延平路三段505號,44549792,瀧澤修三,戴雲錦,戴雲錦,總經理,廖毓婷,03-4643166,60/07/24,92/09/23,新台幣 10.0000元,724562460,72456246,0,0,合併,每年,股東會,群益金鼎證券股份有限公司,02-27023999,台北市大安區敦化南路二段97號B2,勤業眾信聯合會計師事務所,張瑞娜,林淑如,TTT,"NO.505,SEC-3 YENPING ROAD. PINGCHEN DIST.TAOYUAN CITY,TAIWAN",03-4643674,A1004@takisawa.com.tw,www.takisawa.com.tw,廖毓婷,管理本部協理,03-4643166,ting@takisawa.com.tw,http://www.takisawa.com.tw/service-line.php
42,8027,鈦昇科技股份有限公司,鈦昇,電機機械,－,高雄市燕巢區橫山路六十一號,22101002,王明慶,張光明,張光明,總經理,曹瑞龍,(07)6156600,83/10/28,104/06/09,新台幣 10.0000元,1000475890,100047589,0,0,合併,每年,董事會,永豐金證券股份有限公司,(02)23816288,台北市中正區博愛路十七號三樓,國富浩華聯合會計師事務所,李青霖,蔡淑滿,E&R,"61 , Heng Shan Road , Yen-Chau HsiangKaohsiung Taiwan R.O.C",(07)6155511,8027@enr.com.tw,www.enr.com.tw,張光明,總經理,07-6156600,8027@enr.com.tw,https://www.enr.com.tw/list/ir-1580715906.htm
43,8083,瑞穎股份有限公司,瑞穎,電機機械,－,新北市新莊區新北產業園區五權三路八號,16264415,陳柏峰,陳柏津,楊金義,財務課長,江月玲,89904567,86/11/10,93/09/23,新台幣 10.0000元,351331930,35133193,0,0,個別,每年,股東會,元富證券股份有限公司股務代理部,(02)27686668,台北市松山區光復北路11巷35號地下一樓,安永聯合會計師事務所,張志銘,馬君廷,TIC,"NO.8, WU-CHUAN 3RD ROAD NEW TAIPEI INDUSTRIAL PARK XINZHUANG DISTRICT,　NEW TAIPEI CITY, TAIWAN",89903120,info@prohawk.com.tw,www.prohawk.com.tw,楊金義,財務課長,02-89904567,jiyang@prohawk.com.tw,www.prohawk.com.tw
44,8107,大億金茂股份有限公司,大億金茂,電機機械,－,台南市安定區中沙里沙崙4-12號,16359284,吳俊億,楊智元,蔡明志,副總經理,張艾嘉,06-5934786,87/01/05,94/11/15,新台幣 10.0000元,750000000,75000000,0,0,合併,每年,董事會,台新證券股務代理部,02-25048125,台北市中山區建國北路一段96號B1,資誠聯合會計師事務所,林永智,田中玉,KENMOS,"No. 4-12, Shalun, Anding DistTainan City 745, Taiwan (R.O.C.)",06-5933248,robert_tsai@kenmos.com,www.kenmos.com,蔡明志,副總經理,06-5934786 ext.6000,robert_tsai@kenmos.com,http://www.kenmos.com/investors/investors.htm
45,8255,朋程科技股份有限公司,朋程,電機機械,－,桃園市蘆竹區南崁路2段22號1樓,16748101,盧明光,吳憲忠,吳憲忠,總經理,黃錫欽,03-3115555,87/11/17,95/04/25,新台幣 10.0000元,914570000,91457000,0,0,合併,每年,董事會,元大證券股份有限公司股務代理部,(02)2586-5859,103台北市大同區承德路三段210號B1,勤業眾信會計師事務所,蔡振財,邱盟捷,ATC,"1F,No 22 ,Sec 2, Nan-Kan Rd.,Luchu Hsiang, Taoyuan, R.O.C.",03-3119977,IR@actron.com.tw,www.actron.com.tw,吳憲忠,總經理,03-3115555#261,IR@actron.com.tw,www.actron.com.tw
46,9951,皇田工業股份有限公司,皇田,電機機械,－,台南市永康區王行里16鄰永科五路6號,73707377,周幼珊,周幼珊,陳俊智,財務部財務企劃經理,許竹如,(06)2331088,72/07/25,92/12/18,新台幣 10.0000元,749000000,74900000,0,0,合併,每年,董事會,群益金鼎證券股份有限公司,(02)27023999,台北市大安區敦化南路二段97號B2,資誠聯合會計師事務所,林永智,林姿妤,MACAUTO,"No.6, Yongke 5th Rd.,Yongkang Dist., Tainan City, Taiwan",(06)2010999,luke.chen@macauto-group.com,https://www.macauto-group.com/zh-hant/,陳俊智,財務部財務企劃經理,(06)2331088-2900,luke.chen@macauto-group.com,https://www.macauto-group.com/zh-hant/
